
https://amzn.to/3EQnwKw,https://m.media-amazon.com/images/I/613IlYswoOL._AC_SX679_.jpg,Etekcity 0.1g Food Kitchen Scale, Bowl, Digital Grams and Ounces for Weight Loss, Dieting, Baking, Cooking, and Meal Prep, 11lb/5kg, Stainless Steel Silver
https://amzn.to/3ENzm8i,https://m.media-amazon.com/images/I/71jI8eqaE9L._AC_SX679_.jpg,KULUNER TP-01 Waterproof Digital Instant Read Meat Thermometer with 4.6” Folding Probe Backlight & Calibration Function for Cooking Food Candy, BBQ Grill, Liquids,Beef(Black)
https://amzn.to/3EiRVQc,https://m.media-amazon.com/images/I/61JmahvVe0L._AC_SX679_.jpg,KitchenAid RRK150IC 5 Qt. Artisan Series - Ice (Renewed)
https://amzn.to/3hV9bU5,https://m.media-amazon.com/images/I/61Q62ScITjL._AC_SX679_.jpg,ChefAide 4 Pieces Silicone Spatula Set, Food Grade Rubber Spatula, Upgrade Strong Handle with Ergonomic Grip, Heat Resistant Up to 600°F for Nonstick Cookware, Cooking Baking Mixing
https://amzn.to/3VibuyL,https://m.media-amazon.com/images/I/61zsDTvRIKL._AC_SX466_.jpg,LEGERM Cake Decorating Angled Icing Spatula Set of 6 8 & 10 Inch Wooden Handle Stainless Steel Offset Frosting Spatulas
https://amzn.to/3VcLZz5,https://m.media-amazon.com/images/I/61kp5qCnxAL._AC_SX679_.jpg,Ruler Metal Straight Edge Ruler Stainless Steel Ruler 16 Inch Ruler Set Rulers Bulk 1 Pack
https://amzn.to/3TVeakQ,https://m.media-amazon.com/images/I/81aS5nOyyUL._AC_SX466_.jpg,Oleex ‘All-Dough’ Pastry Cutter Set. 5 Wheel Dough Cutter and Dual Fluted Ravioli Cutter Wheel / Pizza Cutter Wheel! Versatile Brownie Cutter, Pasta Maker, Noodle Cutter, Stainless Steel Pizza Slicer
https://amzn.to/3EobIOd,https://m.media-amazon.com/images/I/61+4mw5NEvL._AC_SX679_.jpg,Norpro Grip-EZ Pastry/Ravioli Wheel, Black
https://amzn.to/3Euc99C,https://m.media-amazon.com/images/I/61sJqBdke6L._SX522_.jpg,Candy Thermometer Deep Fry/Jam/Sugar/Syrup/Jelly Thermometer with Hanging Hook & Pot Clip Stainless Steel Cooking Thermometer Food Thermometer Quick Reference Temperature Guide,Black
https://amzn.to/3GD0x6X,https://m.media-amazon.com/images/I/71ilhoRuLcL._AC_SX466_.jpg,Kootek 100-Piece Piping Bags, 16 Inch Pastry Bags, Icing Piping Bags for Frosting, Thick Large Disposable Icing Bags with 5 Bag Ties, Cakes Decorating Bags for Cake Decorating Baking Supplies