
https://amzn.to/3XjHSTF,https://m.media-amazon.com/images/I/61nhBdAz7IL._AC_SX466_.jpg,KITCHPOWER 4.5-5 Quart Flex Edge Beater for KitchenAid Tilt-Head Stand Mixers,Kitchen Aid Attachments for Mixer,Flat Beater With Flexible Edges,White
https://amzn.to/3EM6Aop,https://m.media-amazon.com/images/I/51UcPw6rW9L._AC_SX679_.jpg,KitchenAid K45DH Dough Hook Replacement for KSM90 and K45 Stand Mixer
https://amzn.to/3tNfZWx,https://m.media-amazon.com/images/I/71A50+w5DLL._AC_SX466_.jpg,Pouring Shield, GUCHO Universal Pouring Chute for KitchenAid Bowl-Lift Stand Mixer Attachment/Accessories (pouringA)
https://amzn.to/3OE5AGt,https://m.media-amazon.com/images/I/61Cpip-IvWL._AC_SX466_.jpg,KitchenAid K45WW Wire Whip for Tilt-Head Stand Mixer, Stainless Steel
https://amzn.to/3gpu3m4,https://m.media-amazon.com/images/I/71rbaVQDjdL._AC_SX466_.jpg,KitchenAid KSMSFTAQ Sifter + Scale Attachment, White
https://amzn.to/3OomUPk,https://m.media-amazon.com/images/I/71wyDJSqkfL._AC_SX466_.jpg,KitchenAid KGM All Metal Grain Mill Attachment, Size: 1
https://amzn.to/3EtPMRR,https://m.media-amazon.com/images/I/71cQSaMK8fL._AC_SX679_.jpg,Kitchenaid Artisan Mini Plus 3.5-Qt. Tilt-Head Stand Mixer with Flex Edge Beater, Black Matte
https://amzn.to/3AA5d9P,https://m.media-amazon.com/images/I/71kNmpe6+qS._AC_SX466_.jpg,Pasta Roller Attachment for KitchenAid Stand Mixer, Stainless Steel Pasta Attachment for KitchenAid Stand Mixer, for Kitchen aid Mixer Accessories by Gvode
https://amzn.to/3Viauuv,https://m.media-amazon.com/images/I/612GRQcwhOL._AC_SX466_.jpg,Slicer Shredder Attachments for KitchenAid Stand Mixer Cheese Grater Attachment for KitchenAid, Slicer Accessories with 3 Blades by InnoMoon
https://amzn.to/3grvLmX,https://m.media-amazon.com/images/I/512Dx8xYphL._AC_SX679_.jpg,KitchenAid Pastry Tilt Head Stand Mixer Beater Attachment, Silver